surveyor_full_name,date,time,previous_cloud,previous_rain,previous_wind,previous_visibility,today_cloud,today_rain,today_wind,today_visibility,photo_taken,filename,catcott_lows_eel_number,catcott_lows_comment,catcott_great_fen_eel_number,catcott_great_fen_comment,other_wetland_species,additional_surveyor_notes,minnow_present
"Nathaniel Legall; Matthew Perry, Mary Claridge; Claire Trapp",11.06.19,NA,2,2,1,1,2,1,2,1,0,NA,0,NA,0,NA,1,"10 roach, 10 minnows",
Nathaniel Legall; Claire Trapp,14.06.19,NA,NA,NA,NA,NA,NA,NA,NA,NA,1, IMG_1005,0,NA,0,NA,1,water boatmen,
Nathaniel Legall; Claire Trapp,18.06.19,10:20,3,3,2,1,3,1,1,1,1,IMG_1042,0,NA,0,NA,1,"stop boards on Catcott Lows removed two days prior to survey in order to equalise water. Heavy flow towards ditch. 50+ minnow, 50+ roach.",
Nathaniel Legall; Claire Trapp,21.06.19,10:20,3,2,1,1,2,1,1,1,0,NA,0,NA,0,NA,1,"Ballerina skirt on reserve side of Catcott Lows set in wrong position. Net with one corner on stop boards. 90+ minnow, 4 tench, 10+ stick insects, water boatmen, mollusca sp. Damselfly nymph. ",
Nathaniel Legall,25.06.19,11:00,3,2,1,1,3,1,1,1,1,IMG_1063,0,NA,0,NA,1,"Catcott GF = 20+ mollusca, 5 worms, 40+ minnow, 5 stickleback, 1 roach. Catcott Lows = 5+ damselfly nymphs, 30+ freshwater shrimps, 40+ mollusca spp. 5+ arachnidae. 1 minnow casualty, 1 stickleback casualty.",
NA,28.06.19,NA,NA,NA,NA,NA,NA,NA,NA,NA,NA,NA,NA,NA,NA,NA,NA,NA,
Nathaniel Legall; Joanna Perry,02.07.19,10:00,1,1,1,1,1,1,1,1,0,NA,0,NA,0,NA,1,"Catcott GF = 6 minnow, 45 mollusca sp., 5 tench, 50+ freshwater shrimp, 5+ leach. Catcottt Lows = 1 common newt, 1 damselfly nymph,  1 water scorpion, 5 water boatman, 1 damselfly nymph, 1 stick insect, beetle larvae, 36 freshwater shrimp, 11 mollusca sp. ",
